{
  "schemaVersion": "0.1.0",
  "generatedAt": "2026-09-09T00:00:00-06:00",
  "sourceId": "source:pka-admin-wiki",
  "extractor": {
    "id": "manual-page-field-extract",
    "version": "0.1.0",
    "inputLocator": "https://wiki.pokealliance.com/quests/porygon-dr-vektor",
    "inputDigest": "sha256:2E274712987B929EC3B34BD5A5A44A0CB6B58DE64E7261949F67708FDF787EA4"
  },
  "records": [
    {
      "stagingId": "staging:pka-admin-wiki:quest:porygon-dr-vektor",
      "domain": "quest",
      "sourceLocator": "requirements, entry, time limit, puzzle, reward and permanent-access sections",
      "raw": {
        "title": "Porygon Quest: Dr. Vektor",
        "requiredLevel": 200,
        "npc": "Dr. Vektor",
        "entry": "Use the computer beside Dr. Vektor after accepting the research request",
        "timeLimitMinutes": 45,
        "instanceLimit": "one player at a time",
        "boss": "Giant Porygon",
        "rewards": ["5,000,000 experience", "50 Empty Alliance Ball", "50 Empty Yume Ball", "4 Enhanced Normal Stone", "permanent access to the Porygon-area computer"],
        "area": "Digital World / Porygon area"
      },
      "issues": [
        "Quest repeatability and formal prerequisite graph were not stated as structured fields.",
        "NPC and area coordinates were not provided by this page."
      ]
    }
  ]
}
