{
  "schemaVersion": "0.1.0",
  "generatedAt": "2026-09-09T00:00:00-06:00",
  "sourceId": "source:pka-admin-wiki",
  "extractor": {
    "id": "manual-page-field-extract",
    "version": "0.1.0",
    "inputLocator": "https://wiki.pokealliance.com/gen/4/chimchar",
    "inputDigest": null
  },
  "records": [
    {
      "stagingId": "staging:pka-admin-wiki:pokemon:chimchar",
      "domain": "pokemon_variant",
      "sourceLocator": "basic information, evolution and PVE moves",
      "raw": {
        "name": "Chimchar",
        "pokedexNumber": 390,
        "hp": 470,
        "experience": 1575,
        "requiredLevel": 30,
        "tier": "T6",
        "function": "PVE"
      },
      "issues": [
        "Elements and availability status were not captured in this pass.",
        "Move and evolution relationships require separate entity extraction."
      ]
    }
  ]
}
